1278898;Hunger Games: Catching Fire - Suzanne Collins
1278181;Alimente Care Ucid Creierul (reeditare) - David Perlmutter
1278180;Noile Confesiuni Ale Unui Asasin Economic - John Perkins
1278179;Clubul Bilderberg (reeditare) - Cristina Martin
1277326;Suport plastic pentru agrafe EVOffice Trendy Line, alb
1275039;Incalzitor instant pentru apa Ariston Fast EVO B 14 GN EU, 27 kW, 14 l/min, 10 bar, Control electronic al temperaturii, Aprindere cu alimentare prin baterie, Gaz metan
1274866;Adaptor biti magnetic Wolfcraft, 72 mm
1273551;Incarcator Energizer de priza microUSB, cablu 1m, 1 Amp
1271749;Gantera Sport Partner vinyl, Roz, 2kg
1270500;Pantofi alergare New Balance 690 pentru copii, Blue, 33.5
1232036;Placa video SAPPHIRE Radeonª RX 480 NITRO+, 4GB GDDR5, 256-bit
978007;Gel de dus Bourjois Reconforte Moi, 250 ml
903347;Selfie Stick A+, 88 cm, Cablu 3.5 mm, Albastru
888381;Drona Parrot Airborne Cargo Mars
1293498;Imagini, litere si documente de calatorie - Gheorghe Craciun
1290957;Chiloti roz garoafa, Moschino, L
1287068;Folie de protectie din sticla temperata 9H Lemontti pentru HTC One A9
1286554;Arta de a fi fericit intr-o Lume Zbuciumata - Dalai Lama
1286205;Rola prosop din hartie Stok Professional, alba, 2 straturi, portionata, gofrata, celuloza 75%, 450 portii, 108 metri, 6 role/bax
1285222;Baton energizant Isostar Reload Energy, 40 g
1285221;Pudra izotonica Isostar High Protein Fresh, 400 g
1285220;Pudra izotonica Isostar High Protein Orange, 400 g
1285058;Unt de corp Thai Spa Vanilie, 200 g
1282717;Solutie decalcifianta profesionala masini cafea, espressoare Heitmann, 250 ml
1281837;Masa calcat GIMI Classic, model cale
1281833;Masa calcat GIMI Leo 110 x 33cm, model iedera
1281317;Set de constructie Momki, Casuta cu terasa si vehicul
1281315;Set de constructie Momki, Trasura si cal
1280788;Anvelopa Iarna Hankook W320 215/55 R16 93H
1280787;Anvelopa Iarna Semperit Speed Grip 2 175/65 R15 84T
1280777;Anvelopa Iarna Viking Snowtech 235/45 R17 94H
1279843;Casti audio Bluetooth, Pioneer, SE-MJ553BT-R, Rosu
1278897;The Hunger Games - Suzanne Collins
1278178;Limba si Literatura Romana. Teste Pentru Clasa A IV-A
1278177;1200 de Exercitii si Probleme de Matematica. Clasa A II-A
1274865;Adaptor biti magnetic Wolfcraft, 60 mm
1271748;Gantera Sport Partner vinyl, Mov, 1kg
1270499;Pantofi sport New Balance 420 pentru copii, Black, 40
1231858;Tratament ser Delia Cosmetics Cameleo cu Ulei de Marula pentru par vopsit, 55 ml
964721;Ceas de Dama Fossil Jacqueline ES3737
888372;Drona Parrot Airborne Night SWAT
399985;Detergent capsule Ariel 3in1 PODS, 15 spalari
284077;Detergent universal pentru suprafete Mr Proper Ocean, 1.5 l
1291734;Ceas Smartwatch iUni U8+, Bluetooth, Activity & Sleep Monitor, Red
1290956;Chiloti roz garoafa, Moschino, M
1285219;Pudra izotonica Isostar High Protein Lemon, 400 g
1285218;Pudra izotonica Isostar Endurance + High Carb, 790 g
1281831;Masa calcat GIMI Leo 110 x 33cm, model feriga
1281819;Pompa Medela Harmony manuala bifazica
1281314;Set de constructie Momki, Vehicul pentru filaj
1281313;Set de constructie Momki, Vehicul de interventie pe apa
1281312;Set de constructie Momki, Barca politie pentru interventie
1280774;Anvelopa Iarna Dunlop Winter Sport 3D MS MO 255/55 R18 105H
1280772;Anvelopa Iarna Hankook W320 245/40 R18 97V XL
1278176;Limba si Literatura Romana. Caiet de Pregatire. Clasa A VIII-A
1278175;Limba si Literatura Romana. Caiet de Pregatire. Clasa A VII-A
1278174;Acceptarea Neconditionata - Tara Brach
1275038;Incalzitor instant pentru apa Ariston Fast EVO B 11 GPL EU, 21.5 kW, 11 l/min, 10 bar, Control electronic al temperaturii, Aprindere cu alimentare prin baterie, GPL
1274864;Adaptor biti magnetic Wolfcraft, 50 mm
1274862;Pachet Cronici - 4 carti
1274458;Pantofi sport Skechers Agility pentru femei, Black/Pink, 36
1270498;Pantofi sport New Balance 420 pentru copii, Black, 38.5
1190489;Masina de tocat Heinner MG1500TA-BG, 1600 W, Accesoriu pentru rosii si carnati, Cutit inox, Visiniu sidefat
1131107;"Laptop 2 in 1 Allview Wi901N cu procesor Intel¨ Atomª Quad Core Z3735F 1.33 GHz, 8.9"", IPS, Touchscreen, 2GB, 32GB, Microsoft Windows 10, Black"
1071181;Detergent Lichid Ariel Sensitive 40 spalari, 2.6L
284076;Detergent universal pentru suprafete Mr Proper Lemon, 1.5 l
1285217;Pudra izotonica Isostar Endurance + Bautura izotonica rosii, 4 x 48 g
1281813;Uscator rufe GIMI Albatross
1281310;Set de constructie Momki, Vehicul politie pentru interventie
1280764;Anvelopa Iarna Nankang SV-2 195/60 R16 89H
1280761;Anvelopa Iarna Nankang SV-2 185/65 R15 92H XL
1278173;Ragtime. El Doctorow. Clasici Moderni
1278172;Lumi Fantastice. Carte de Colorat
1275037;Incalzitor instant pentru apa Ariston Fast EVO B 11 GN EU, 21.5 kW, 11 l/min, 10 bar, Control electronic al temperaturii, Aprindere cu alimentare prin baterie, Gaz metan
1274861;Pachet Umberto Eco - 5 carti
1274859;Pachet CE SI CUM? - 14 carti
1274858;Pachet Hermann Hesse - 7 carti
1274550;Rama foto pentru perete Altom Design
1273470;Acumulator extern Mediacom M-PBSF25 2500mAh, indicator LED status incarcare, Alb
1270497;Pantofi sport New Balance 420 pentru copii, Black, 37.5
1231839;Tratament ser Delia Cosmetics Cameleo cu Ulei de Argan pentru par cret, 55 ml
1231819;Tratament ser Delia Cosmetics Cameleo cu Ulei de Macadamia pentru par subtire si slabit, 55 ml
1071180;Detergent Lichid Ariel Touch of Lenor Fresh 40 spalari, 2.6L
1071179;Detergent Lichid Ariel Mountain Spring 40 spalari, 2.6L
887780;Ceas auriu Blair, de dama, Michael Kors, MK5639
585290;Cuptor incorporabil Bosch HBN532E3, Electric, 66 l, Convectie, Curatare catalitica , Clasa A, Inox
1291722;Ceas Smartwatch iUni U900i, Bluetooth, Green
1285216;Pudra izotonica Isostar High Protein Antiox Fructe rosii, 400 g
1285214;Baton energizant Isostar Powerplay High Protein Capsuni, 35 g
1281812;Uscator rufe extensibil GIMI Stendissimo
1281811;Uscator rufe GIMI Zaffiro, 20 m
1280760;Anvelopa Iarna Nankang SV-2 185/55 R16 87T XL
1280726;Anvelopa Iarna Semperit Speed Grip 2 205/60 R16 92H
1280719;Anvelopa Iarna Semperit Master Grip 2 195/65 R15 91T
1278171;Menajeria. Carte de Colorat cu Portrete de Animale
1278170;Disney. Regatul de Gheata. Anna si Elsa: Vremea Copilariei - Posetuta
1278169;Disney. Sofia Intai. Amuleta Din Avalor - Posetuta
1274853;Difuzor auto tip subwoofer Pioneer TS-W311, 30 cm, 1000 W
1274831;Radio MP3 Player auto Pioneer MVH-X580BT, 4x50 W, USB, AUX, RCA, Control iPod/iPhone, Android, Spotify, Bluetooth
1274549;Rama foto lemn Altom Design
1273447;Aplica Disney Philips, LED, 0.3W, Albastru
1271504;Set de joaca IMC, Minnie Mouse cu accesorii de frumusete
1270496;Pantofi sport New Balance 420 pentru copii, Black, 36
1231795;Tratament ser Delia Cosmetics Cameleo Silky cu Ulei de Argan pentru par deteriorat, 55 ml
1054044;Capac spate Huawei P8 Lite, Kaki/Gold
1043678;Servetele de masa OTI Easter Egs in Line, 3 straturi, 20 buc, Verde
952910;Servetele umede Renova Lavander Fresh Wipes, 20 buc
898980;Apa de Toaleta Salvatore Ferragamo Signorina, Femei, 30 ml
898872;Apa de Toaleta Salvatore Ferragamo Acqua Essenziale, Barbati, 50 ml
894591;Sursa Modulara Corsair RMi Series RM650i, 80 PLUS¨ Gold, 650 W, PFC Activ, ATX 2.4, 13.5 cm fan, Negru, retail
876827;Aspirator Sencor SVC BL 45 Bag, 1200W, Indicator Praf-full, Roti de cauciuc, Albastru
535161;Telefon mobil Allview V1 Viper i4G, Dual SIM, 4G, 8 GB, White
1297472;Casti On-Ear Beats by Dr. Dre Solo HD, Matte Pink
1285213;Baton energizant Isostar Powerplay High Protein Alune, 35 g
1285211;Gel energizant Isostar Energy Lemon, 4 x 35 g
1284446;24DM3000 zapada protectie
1284445;24DM3000 cutie
1281810;Uscator rufe GIMI Rocky, 20 m
1280758;Anvelopa Iarna Dunlop Winter Sport 5 235/55 R17 99V
1280756;Anvelopa Iarna Dunlop Winter Sport 5 MFS 235/45 R17 97V
1280717;Anvelopa Iarna Semperit Master Grip 2 195/60 R15 88T
1278162;1200 de Exercitii si Probleme de Matematica. Clasa A III-A
1278154;Set 4 pahare Villeroy&Boch, pentru apa
1274829;Radio MP3 Player auto Pioneer MVH-280FD, 4x100 W, USB, AUX, RCA, Control iPod/iPhone
1273445;Aplica Disney Cars  Philips, LED, 0.3W, Rosu
1270495;Pantofi sport New Balance 420 pentru copii, Black, 35
952906;servetele umede Humid Toilet Paper Renova Refil, 40 buc/pachet
892615;Periuta de dinti electrica Oral-B PRO 2500 Cross Action + Travel Case, reincarcabila, curatare 3D, 2 programe, 1 capat, suport de calatorie inclus, Roz
1297470;Casti On-Ear Beats by Dr. Dre Solo HD, Matte White
1291718;Ceas Smartwatch iUni U26, Bluetooth, Stopwatch, Carcasa metalica, White
1291717;Ceas Smartwatch iUni U26, Bluetooth, Stopwatch, Carcasa metalica, Black
1287569;Tricou Adidas  Estro 15  pentru barbati, Black/White, XXL
1287568;Tricou Adidas  Estro 15  pentru barbati, Black/White, XL
1287067;Folie de protectie din sticla temperata 9H Lemontti pentru HTC Desire 530
1285210;Gel energizant Isostar Energy Apple, 4 x 35 g
1284444;24DM3000 stand
1284443;24DM3000 eticheta
1284442;24DM3000 cablu lvds
1284441;24DM3000 cablu alimentare
1284440;24DM3000 difuzor
1281809;Uscator rufe + cos clame GIMI Malibu, 18 m
1281807;Uscator rufe GIMI Cucciolo, 10 m
1280754;Anvelopa Iarna Dunlop Winter Sport 3D ROF MS 225/55 R17 97H
1280749;Anvelopa Iarna Pirelli W240 S2 225/40 R18 92V XL
1280714;Anvelopa Iarna Hankook W452 195/50 R15 82T
1280713;Anvelopa Iarna Hankook W452 185/65 R15 88T
1278896;The Great Gatsby (R/I) - Fitzgerald F Scott
1278892;The Master and Margarita - Bulgakov Mikhail
1278891;Mrs Dalloway - Woolf Virginia
1278890;The Great Gatsby - Fitzgerald F Scott
1278804;Matilda - Shelley Mary
1278153;Set 4 pahare Villeroy&Boch din cristal, pentru vin
1277325;Suport birou plastic echipat, 18 piese, negru
1277324;Separatoare carton color EVOffice, 160 g, 10x24 cm 100 bucati/set - 4 culori asortate
1274828;Radio MP3 Player auto Pioneer MVH-190UBG, 4x50 W, USB, AUX, RCA, Android
1274827;Radio MP3 Player auto Pioneer MVH-190UB, 4x50 W, USB, AUX, RCA, Android
1273431;Aplica Disney Star Wars Philips, LED, 0.3W, Negru
1270494;Pantofi sport New Balance 420 pentru copii, Black, 33.5
1013657;Joc Monopoly Frozen
808692;Sursa Corsair VS Series CP-9020097-EU, 550 W, PFC Activ, ATX 2.31, 12 cm fan, Negru
781403;Detergent lichid pentru rufe bebelusi Frosch Musetel, 1.5 l
773238;Pasta termoconductoare Cooler Master IC Essential E1 4,6g
576369;Sursa Corsair VS Series CP-9020095-EU, 350 W, PFC Activ, ATX 2.31, 12 cm fan, Negru
535160;Telefon mobil Allview V1 Viper i4G, Dual SIM, 4G, 8 GB, Black
156734;Kit Corsair 16GB (4 x 4GB), DDR3, 1600MHz, radiator
1297468;Casti On-Ear Beats by Dr. Dre Solo HD, Matte Black
1291715;Ceas Smartwatch iUni U26, Bluetooth, Stopwatch, Carcasa metalica, Blue
1291714;Ceas Smartwatch cu telefon iUni U15 A+, Bluetooth, Camera 1.3 MP, Slot card, Sleep Monitor, Carcasa metalica, Gold
1287567;Tricou Adidas  Estro 15  pentru barbati, Black/White, L
1287066;Folie de protectie din sticla temperata 9H Lemontti pentru Huawei Ascend P8 Lite
1285209;Gel energizant Isostar Endurance + Veggie piure, 90 g
1285207;Baton energizant Isostar High Energy Banana, 40 g
1284439;24DM3000 telecomanda
1284438;24DM3000 placa ir
1284437;24DM3000 tasta
1284436;24DM3000 placa conectare
1284435;24DM3000 manual
1284434;22DM3000 zapada protectie
1281806;Uscator rufe GIMI Ring
1281805;Uscator rufe GIMI Top, 20 m
1280747;Anvelopa Iarna Dunlop Winter Sport 5 215/65 R16 98H
1280672;Anvelopa Iarna Viking Snowtech 205/55 R16 91T
1280670;Anvelopa All season Viking Fourtech 205/55 R16 91H
1278885;White Nights - Dostoyevsky Fyodor
1278883;Waterloo - Hugo Victor
1278875;To Be Read at Dusk - Dickens Charles
1278867;The Tempest - Shakespeare William
1278866;The Stolen White Elephant - Twain Mark
1278843;The Death of Ivan Ilyich - Tolstoy Leo
1278124;Prelungitor Well, 6 prize, intrerupator, ignifug, 3xG1.5mmp, 3 m
1277323;Perforator plastic EVOffice Trendy Line, 20 coli, alb
1274826;Radio MP3 Player auto Pioneer MVH-190UI, 4x50 W, USB, AUX, RCA, Control iPod/iPhone
1271747;Saltea Energy Fit  pentru Yoga
1270493;Pantofi sport New Balance 420 pentru copii, Black, 32.5
890336;Telefon mobil Apple iPhone 6S, 128GB, Rose Gold
544382;Top 10 - Suflete moarte - N.V. Gogol
255388;Detergent automat Ariel Touch of Lenor Fresh, 80 spalari, 8 kg
156708;Kit Dual Channel Corsair 8GB (2 x 4GB), DDR3, 1600MHz, radiator
147615;Kit Dual Channel Corsair 8GB (2 x 4GB), DDR3, 2000MHz
1291713;Ceas Smartwatch pentru copii iUni Kid90, GPS Tracker + Telefon, Alarma SOS, Blue
1287566;Tricou Adidas  Estro 15  pentru barbati, Black/White, M
1287062;Folie de protectie din sticla curbata Lemontti pentru Huawei Ascend P9, Black
1287061;Husa de protectite Moon Just Must pentru iPhone 7, Silicon, Red
1285206;Baton energizant Isostar High Energy Fructe rosii, 40 g
1284433;22DM3000 cutie
1284432;22DM3000 stand
1284431;22DM3000 eticheta
1281804;Uscator rufe GIMI Brezza 100, 10 m
1280743;Anvelopa Iarna Dunlop Winter Sport 5 215/55 R16 93H
1280653;Anvelopa Iarna Viking Snowtech 185/65 R15 88T
1278839;The Castle - Kafka Franz
1278832;Tender is the Night - Fitzgerald F. Scott
1278830;Speak Memory - Nabokov Vladimir
1278827;Seeing Things as They Are: Selected Journalism and Other Writings - Orwell George
1278123;Prelungitor Well, 6 prize, ignifug, 3xG1.5mmp, 3 m
1278116;Prelungitor Well, 4 prize, intrerupator ignifug, 3xG1.5mmp, 1.5 m
1277322;"Perforator metalic ""40% power saving"" 45 coli Deli, negru"
1274825;Player auto Pioneer MVH-08UBG, 4x50 W, USB, AUX, RCA, RDS
1274824;Player auto Pioneer MVH-08UB, 4x50 W, USB, AUX, RCA, RDS
1271575;Jucarie de plus cu sunete Sofia Intai, Minimus
1270492;Pantofi sport New Balance 420 pentru copii, Black, 31
1164217;Mouse Canyon CNS-CMSW6Y, USB, Wireless, Galben
519414;Detergent lichid Ariel Mountain Spring 60 spalari, 3.9 l
255385;Detergent Automat Ariel Mountain Spring 80 spalari, 8kg
1291711;Ceas Smartwatch pentru copii iUni Kid90, GPS Tracker + Telefon, Alarma SOS, Orange
1287565;Tricou Adidas  Estro 15  pentru barbati, Black/White, S
1287563;Pantaloni lungi Adidas  Core 15  pentru barbati, Grey/White, XL
1285205;Baton energizant Isostar High Energy Ciocolata, 55 g
1284430;22DM3000 cablu lvds
1284429;22DM3000 cablu alimentare
1284428;22DM3000 difuzor
1284427;22DM3000 telecomanda
1281803;Uscator rufe GIMI Brezza, 60.5 m
1280742;Anvelopa Iarna Dunlop Winter Sport 5 MFS 215/50 R17 91H
1280738;Anvelopa Iarna Goodyear UG8 205/55 R16 91T
1280137;Anvelopa Iarna Federal Himalaya SUV 225/55 R18 98T
1278826;Robinson Crusoe - Defoe Daniel
1278822;Pnin (R/I) - Nabokov Vladimir
1278821;Persuasion (R/I) - Austen Jane
1278815;Oliver Twist - Dickens Charles
1278113;Prelungitor Well, 4 prize, 3xG1.5mmp, 1.4 m
1277321;"Perforator metalic ""40% power saving"" 45 coli Deli, albastru"
1275034;Convector electric de podea Vortex CH-09FLCD, 2300 W, 3 trepte, Termostat, Telecomanda, Timer, Afisaj LCD
1274817;Player auto Pioneer DVH-340UB, 4x50 W, CD/DVD, USB, AUX, RCA video
1274445;Troler Kring Travel Light, 78 cm, Albastru
1270490;Pantofi sport New Balance 420 pentru Unisex, Black, 45.5
1291709;Ceas Smartwatch pentru copii iUni Kid90, GPS Tracker + Telefon, Alarma SOS, Pink
1287562;Pantaloni lungi Adidas  Core 15  pentru barbati, Grey/White, L
1287060;Husa de protectite Moon Just Must pentru iPhone 7, Silicon, Pink
1287055;Tinerete fara batranete si viata fara de moarte - Petre Ispirescu
1287054;Muzicantii din Bremen - Fratii Grimm
1285204;Baton energizant Isostar Cereal Max Mere-Caise, 55 g
1284426;22DM3000 placa ir
1284425;22DM3000 tasta
1284424;22DM3000 placa conectare
1284423;22DM3000 manual
1281802;Uscator rufe GIMI Alablock, 10 m
1280737;Anvelopa Iarna Dunlop Winter Sport 4D 205/55 R16 91H
1278819;Pale Fire (R/I) - Nabokov Vladimir
1278811;Northanger Abbey (R/I) - Austen Jane
1278808;My Life had Stood a Loaded Gun - Dickinson Emily
1278112;Prelungitor Well, 3 prize, intrerupator ignifug, 3xG1.5mmp, 3 m
1275024;Aeroterma ceramica de perete Vortex PTC3015L, 2 trepte de putere, Termostat, Timer, Indicator luminos, Protectie supra-incalzire, Display LED, Telecomanda
1274444;Troler Kring Travel Light, 68 cm, Albastru
1272083;Hard Disk Laptop Seagate Barracuda, 500GB, 5400 rpm, 2,5' SATA III
1271574;Jucarie de plus cu sunete Sofia Intai, Clover
1259789;"Laptop Lenovo IdeaPad 100-15IBD cu procesor Intel¨ Coreª i5-5200U 2.20 GHz, Broadwellª, 15.6"", 4GB, 1TB, Intel¨ HD Graphics, Free DOS, Black"
490100;"In fata blocului - O colectie de 55 de jocuri si ""faze"" ale generatiei cu cheia la gat"
1291682;Ceas Smartwatch iUni V88, Bluetooth, Activity & Sleep Monitor, Carcasa metalica, Black
1291681;Ceas Smartwatch pentru copii iUni U11, Bluetooth, GPS Tracker + Telefon, Alarma SOS, Green
1287561;Pantaloni lungi Adidas  Core 15  pentru barbati, Grey/White, M
1287053;Ursul pacalit de vulpe - Ion Creanga
1286923;Gratar electric Sencor SBG 2050SS, 1000W, Gri
1285201;Biscuiti energizanti Isostar Endurance, 100 g
1285196;Bidon Isostar Silver, 650 ml
1284422;19DM3000 zapada protectie
1284421;19DM3000 cutie
1284420;19DM3000 stand
1284419;19DM3000 eticheta
1284418;19DM3000 cablu lvds
1281801;Uscator rufe GIMI Jolly/Basic, 18 m
1280736;Anvelopa Iarna Dunlop Winter Sport 5 205/55 R16 91H
1280135;Anvelopa Iarna Federal Himalaya WS2 225/45 R18 91T
1278788;Lady Susan - Austen Jane
1278784;Invitation to a Beheading (R/I) - Nabokov Vladimir
1278782;Inspirations - Coelho Paulo
1278772;Emma - Austen Jane
1277320;"Perforator metalic ""40% power saving"" 25 coli Deli, albastru"
1274813;Player auto Pioneer FH-X840DAB, 4x50 W, DAB, USB, AUX, RCA, Control iPod/iPhone, Android, Bluetooth, MIXTRAX, Spotify
1270488;Pantofi sport New Balance 420 pentru Unisex, Black, 44.5
1260231;HDD SeagateÊBarraCuda¨ 2TB, 7200rpm, 64MB cache, SATA III
1214370;Aparat foto digital Olympus TG-870, 16 MP, Impermeabil, Rezistent la socuri, Verde
874312;Acumulator extern ASUS ZenPower, 10050 mAh, Gold
852431;Range Extender Wireless ASUS RP-N12 Wireless-N300, 1 x RJ45 10/100
1287558;Pantaloni lungi Adidas  Core 15  pentru barbati, Black/White, XL
1285195;Bidon Isostar Black, 1L
1284417;19DM3000 cablu alimentare
1284416;19DM3000 difuzor
1284415;19DM3000 telecomanda
1284414;19DM3000 placa ir
1280732;Anvelopa Iarna Pirelli Cinturato Winter 195/50 R15 82H
1280728;Anvelopa Iarna Hankook W320 225/45 R18 95V
1278769;David Copperfield - Dickens Charles
1278766;Crime and Punishment - Dostoevsky Fyodor
1278760;Animal Farm (The Illustrated Edition) - Orwell George
1278755;A Short History of Decay - Cioran E. M.
1278108;Prelungitor Well, 3 prize, intrerupator ignifug ,3xG1.5mmp, 1.5 m
1275022;Aeroterma ceramica Vortex PTC2061, 2000 W, 2 trepte de putere, Termostat, Indicator luminos, Protectie supra-incalzire, Functie oscilare
1274812;Player auto Pioneer FH-X730BT, 4x50 W, USB, AUX, RCA, Control iPod/iPhone, Android, Bluetooth, MIXTRAX, Spotify
1274443;Troler Kring Travel Light, 58 cm, Albastru
1271568;Set papusi Sofia Intai, familia regala
1255793;Controller wireless Microsoft model 2016 Negru pentru Xbox One
1281281;Set pasta de modelat Momki, Numaratoarea vesela
1280143;Anvelopa Iarna Fulda Kristal Montero MS 195/70 R14 91T
1280133;Anvelopa Iarna Federal Himalaya WS2 215/60 R16 99T XL
1278747;Nineteen Eighty-Four - Orwell George
1278746;Lolita - Nabokov Vladimir
1278745;Animal Farm (R/I) - Orwell George
1278744;The Soul of the Marionette - Gray John
1278106;Prelungitor Well, 3 prize, intrerupator,3xG1.5mmp, 1.5 m
1277319;"Perforator metalic ""40% power saving"" 25 coli Deli, negru"
1274811;Player auto Pioneer DEH-X8700BT, 4x50 W, CD, USB, AUX, RCA, Control iPod/iPhone, Android, Bluetooth, MIXTRAX
1274402;Videoproiector Acer H6517ABD, DLP 3D, Full HD, 3400 lumeni
1274401;Videoproiector Acer H5382BD, DLP 3D, WXGA, 3300 lumeni
1270419;Pantofi alergare New Balance 880 pentru barbati , Grey, 44.5
1269143;Pungi cu sistem ZIPP de inchidere ALUFIX, 1L 15 bucati
1260225;HDD SeagateÊBarraCuda¨ 1TB, 7200rpm, 64MB cache, SATA III
1258652;Microsistem audio Pioneer, CD/MP3, USB, Aux In, AM/FM, 2 x 15 W, Negru
736989;Plita incorporabila Gorenje G6N40IB, Gaz, 4 arzatoare, Negru
384653;Casti audio In-ear Beats by Dr. Dre Tour 2.0, Negru
274576;"Monitor LED AOC 21.5"", Wide, Full HD, DVI, Negru, E2260SWDA"
1278743;One with You: A Crossfire Novel - Day Sylvia
1278738;The Stranger I Married - Day Sylvia
1278728;Spellbound - Day Sylvia
1278727;Seven Years to Sin - Day Sylvia
1275020;Aeroterma ceramica Vortex PTC02A, 1500 W, 2 trepte de putere, Termostat, Indicator luminos, Protectie supra-incalzire, Functie oscilare
1275015;Cablu Audio Energizer, jack-jack 3.5mm, pentru telefoane/tablete, Mov
1274808;Player auto Pioneer DEH-3900BT, 4x50 W, CD, USB, AUX, RCA, Control iPod/iPhone, Android, Bluetooth
1274400;Videoproiector Acer X127H, DLP 3D, XGA, 3600 lumeni
1273420;Lenjerie de pat Royal Textile Minnie&Mickey, 180x200cm, Alb
1271567;Set de joaca Sofia Intai, Cursul de arta
1263492;Spray colorat pentru radacina L'Oreal Professionnel Hair Touch UP, Blond, 75 ml
1258605;Prajitor de paine Gorenje T1000E, 1000 W, 7 Nivele, Pereti reci, Inox
1248398;Bec auto far halogen Osram H7 Night Breaker Laser,+130%, 55W, 12V, Px26D, 2Buc
1135077;"Laptop Dell Vostro 3558 cu procesor Intel¨ Coreª i3-5005U 2.00GHz, Broadwellª, 15.6"", 4GB, 500GB, DVD-RW, Intel¨ HD Graphics, Ubuntu 14.04 SP1, Black"
1095974;"Tableta Allview Viva i701G, 7"", Quad Core 1Ghz, 1GB RAM, 8GB, 3G, Black"
890332;Telefon mobil Apple iPhone 6S, 128GB, Gold
399990;Detergent capsule Ariel 3in1 PODS Touch of Lenor, 15 spalari
1302182;Smartphone Lenovo P90, Black
1302181;Smartphone Lenovo Vibe X2, Red
1302178;Smartphone Lenovo Vibe Z2, Gray
1302173;Telefon mobil Lenovo Vibe P1m, Dual SIM, White
1302172;Smartphone Lenovo Vibe P1m, Single SIM, Black
1278726;Scandalous Liaisons - Day Sylvia
1278724;Reflected in You: Crossfire Book 2 - Day Sylvia
1278723;Pride and Pleasure - Day Sylvia
1278722;Passion for the Game - Day Sylvia
1277317;Lipici stick Deli, 36 g
1274807;Player auto Pioneer DEH-09BT, 4x50 W, CD, USB, AUX, Control iPod/iPhone, Bluetooth
1274395;Joc The Elder Scrolls Skyrim Special Edition pentru PlayStation 4
1273419;Lenjerie de pat Royal Textile Cars Lightning, 140x200cm, Rosu
1271566;Set de joaca Sofia Intai, dulapiorul lui Amber
1270417;Pantofi alergare New Balance 880 pentru barbati , Grey, 43
1260222;HDD Laptop Seagate BarraCuda¨Ê2TB, 5400rpm, 128MB cache, SATA III
1248396;Bec auto far halogen Osram H4 Night Breaker Laser, +130%, 60/55W, 12V, P43T, 2Buc
1074498;Aparat foto digital Nikon COOLPIX A900, 20 MP, Negru
1029069;Televizor SUHD Curbat Smart Samsung, 123 cm, 49KS7502, 4K Ultra HD
1003718;Telefon mobil Allview X3 Soul Mini, Dual SIM, 16GB, Grey
890329;Telefon mobil Apple iPhone 6S, 128GB, Silver
857623;Casti audio In-ear Beats by Dr. Dre urBeats, Roz
1280130;Anvelopa Iarna Debica Frigo 2 185/70 R14 88T
1277316;Lipici stick Deli, 20 g
1275011;Statie de incarcare Energizer 4 USB, 4.2A, Alb
1274806;Player auto Pioneer DEH-2900UI, 4x50 W, CD, USB, AUX, RCA, Control iPod/iPhone, MIXTRAX
1274392;Joc Just Dance 2017 pentru PlayStation 4
1270406;Pantofi alergare New Balance 880 pentru barbati , Blue, 43
1260035;Acumulator VRLA nJoy, 12V 4.5Ah, PW5123
1259639;The Game - Strauss Neil
1259461;Drive - Pink Daniel H.
979881;Telefon mobil Allview V2 Viper I, Dual SIM, 16GB, Black
890326;Telefon mobil Apple iPhone 6S, 128GB, Space Gray
1275010;Statie de incarcare Energizer 5 USB, 8A, Alb
1274805;Player auto Pioneer DEH-1900UBG, 4x50 W, CD, USB, AUX, RCA
1273418;Lenjerie de pat Royal Textile Cars carbon, 140x200cm, Gri
1271565;Set de joaca Sofia Intai, laboratorul vrajitorului
1270401;Pantofi alergare New Balance 610 pentru barbati , Grey, 47
1254135;Televizor Smart LED Star-Light, 140 cm, 55DM6000, Full HD
469053;Masina de gaurit cu percutie Heinner IMD24, 810 W, 3200 RPM, Mandrina 13 mm, 9 Burghie incluse
53811;Ondulator Remington Ci76, 1 Accesoriu, Ceramic, Negru
1277314;Dosar plastic cu 40 folii EVOffice, verde
1274804;Player auto Pioneer DEH-1900UBB, 4x50 W, CD, USB, AUX, RCA
1274391;Joc Just Dance 2017 pentru PlayStation 3
1273417;Lenjerie de pat Royal Textile Minnie Mouse Multi Bow, 140x200cm, Rosu
1271564;Set papusa Sofia Intai, Amber si Whatnaught, 8 cm
1263489;Tetina anticolici Munchkin, 6+ 2buc
1260021;Acumulator VRLA nJoy, 12V 12Ah, PW12123A, conector T2 (F2), dimensiuni 151mm x 65mm x 94mm
1260007;Labirintul. Incercarile Focului. James Dashner. Vol. 2. Reeditare
1114126;Balsam Pantene Aqualight, 75 ml
979892;Memorie USB Lexar JumpDrive S25, 32GB, USB 3.0, Verde
460215;Apa de Parfum Roberto Cavalli Roberto Cavalli, Femei, 75 ml
1277313;Dosar plastic cu 40 folii EVOffice, rosu
1275005;Incarcator retea 3in1 Energizer, 2USB, 1Ah pentru Nokia
1274803;Player auto Pioneer DEH-1900UBA, 4x50 W, CD, USB, AUX, RCA
1274385;Placa de baza ASUS 970 PRO GAMING AURA, Socket AM3+
1271563;Set papusa Sofia Intai, Jade si Crakle, 8 cm
1270400;Pantofi alergare New Balance 610 pentru barbati , Grey, 46.5
1260006;Mandale Fantezie. Carte de Colorat
37078;Rucsac Laptop Targus Campus TEB01
1277312;Dosar plastic cu 40 folii EVOffice, albastru
1274984;Fular O'neill Blizzard pentru barbati, Black
1274802;Player auto Pioneer DEH-1900UB, 4x50 W, CD, USB, AUX, RCA
1273416;Lenjerie de pat Royal Textile Mickey Mouse Hollywood, 140x200cm, Multicolor
1263488;Tetina anticolici Munchkin, 3+ 2buc
1260005;Abecedar. Perioadele Preabecedara si Abecedara
1260004;Comunicare in Limba Romana. Caiet de scriere pentru Clasa I
1274979;Pachet ingrijire bebelusi NUK: Termometru de baie + Set perie si pieptan + Forfecuta pentru unghii, Verde
1274787;"Solid State Drive (SSD) Biostar S100, 2.5"", 240GB, SATA III"
1274382;Placa video ASUS Radeonª RX 460 STRIX GAMING OC, 4GB GDDR5, 128-bit
1273415;Lenjerie de pat Royal Textile Minnie Why Hello, 140x200cm, Roz
1273413;Aplica Disney Mickey Philips, LED
1271562;Set papusa Sofia Intai, Ruby si Mia, 8 cm
1270399;Pantofi alergare New Balance 610 pentru barbati , Grey, 45.5
1267170;Aspirator fara sac Dirt Devil, 800 W, 2.2 l, 4 accesorii, Filtru HEPA, Rosu
